listing_id,date,available,price,listing_id,id,date,reviewer_id,reviewer_name,comments,id,name,host_id,host_name,neighbourhood_group,neighbourhood,latitude,longitude,room_type,price,minimum_nights,number_of_reviews,last_review,reviews_per_month,calculated_host_listings_count,availability_365,id,listing_url,scrape_id,last_scraped,name,summary,space,description,experiences_offered,neighborhood_overview,notes,transit,access,interaction,house_rules,thumbnail_url,medium_url,picture_url,xl_picture_url,host_id,host_url,host_name,host_since,host_location,host_about,host_response_time,host_response_rate,host_acceptance_rate,host_is_superhost,host_thumbnail_url,host_picture_url,host_neighbourhood,host_listings_count,host_total_listings_count,host_verifications,host_has_profile_pic,host_identity_verified,street,neighbourhood,neighbourhood_cleansed,neighbourhood_group_cleansed,city,state,zipcode,market,smart_location,country_code,country,latitude,longitude,is_location_exact,property_type,room_type,accommodates,bathrooms,bedrooms,beds,bed_type,amenities,square_feet,price,weekly_price,monthly_price,security_deposit,cleaning_fee,guests_included,extra_people,minimum_nights,maximum_nights,calendar_updated,has_availability,availability_30,availability_60,availability_90,availability_365,calendar_last_scraped,number_of_reviews,first_review,last_review,review_scores_rating,review_scores_accuracy,review_scores_cleanliness,review_scores_checkin,review_scores_communication,review_scores_location,review_scores_value,requires_license,license,jurisdiction_names,instant_bookable,is_business_travel_ready,cancellation_policy,require_guest_profile_picture,require_guest_phone_verification,calculated_host_listings_count,reviews_per_month
38296,2019-11-06,"t         ",$80.00,38296,285036,2011-05-28,462622,Leigh-Ann,"I had a perfect stay at Oliver's apartment!  The building was situated behind other buildings and so the apartment was always quiet despite being located in such a bustling urban area.  The location was fantastic and so convenient to groceries, restaurants, shopping and transit!  Oliver was warm and friendly and very helpful in providing suggestions for places to visit that were customized to my interests.  This apartment is a wonderful oasis in busy Berlin!",38296,nice apartment to rent in Neukölln in September!,164310,Oliver,Neukölln,Schillerpromenade,52.485862608293196,13.423619080920695,Entire home/apt,80,"10        ",6,2012-07-27,0.06,1,310,38296,https://www.airbnb.com/rooms/38296,20181107122246,2018-11-07,nice apartment to rent in Neukölln in September!,"Our spacious and bright 2-room apartment will be available the whole month of September for 70 € / night, discount for weekly stay on request or by calculation of AirBnB. Extension is possible. Washing mashine, dishwasher, WiFi, foldable guest bed, etc. Everything provided. Super-nice area. Directly at Hermannplatz, perfect connection to public transport U8/U7","SPACIOUS AND BRIGHT TWO-ROOM APARTMENT TO RENT FOR THE WHOLE MONTH OF SEPTEMBER IN BERLIN_NEUKÖLLN !!! - situated in a really nice neighbourhood @ Hermannstrasse/Hermannplatz, 3 min to Weserkiez, 5 min to Tempelhofer Feld, 2 min to Hasenheide, perfect connection to public transport - completely furnitured & equiped, Internet DSL, Telefone ISDN, washing mashine, Balcony etc. for only (Phone number hidden by Airbnb) € / month - ATTENTION: FLAT AVAILABLE ONLY FOR A MINIMUM OF TWO WEEKS !!! - - WE MIGHT HAVE TO SHORTEN OUR STAY, SO IT'S POSSIBLE THAT WE ARE BACK ON SHORT NOTICE (2-3 DAYS), SO YOU HAVE TO BE FLEXIBLE  E-Mail: (Email hidden by Airbnb)  Mobile: (Phone number hidden by Airbnb)","Our spacious and bright 2-room apartment will be available the whole month of September for 70 € / night, discount for weekly stay on request or by calculation of AirBnB. Extension is possible. Washing mashine, dishwasher, WiFi, foldable guest bed, etc. Everything provided. Super-nice area. Directly at Hermannplatz, perfect connection to public transport U8/U7 SPACIOUS AND BRIGHT TWO-ROOM APARTMENT TO RENT FOR THE WHOLE MONTH OF SEPTEMBER IN BERLIN_NEUKÖLLN !!! - situated in a really nice neighbourhood @ Hermannstrasse/Hermannplatz, 3 min to Weserkiez, 5 min to Tempelhofer Feld, 2 min to Hasenheide, perfect connection to public transport - completely furnitured & equiped, Internet DSL, Telefone ISDN, washing mashine, Balcony etc. for only (Phone number hidden by Airbnb) € / month - ATTENTION: FLAT AVAILABLE ONLY FOR A MINIMUM OF TWO WEEKS !!! - - WE MIGHT HAVE TO SHORTEN OUR STAY, SO IT'S POSSIBLE THAT WE ARE BACK ON SHORT NOTICE (2-3 DAYS), SO YOU HAVE TO BE FLEXIBLE  E-Mail: (Email h",none,NULL,"- es kann sei dass wir kurzfristig zurückmüssen, daher Stornierung +/- 3 Tage im Voraus möglich",NULL,whole apartment,NULL,NULL,NULL,NULL,https://a0.muscache.com/im/pictures/75465883/271bf752_original.jpg?aki_policy=large,NULL,164310,https://www.airbnb.com/users/show/164310,Oliver,2010-07-12,"Berlin, Berlin, Germany","(Hidden by Airbnb) Likes:
Las Papayas de Celaya, Jonathan Emile, Berlin, Germany, Concerts in Berlin, cassiopeia Berlin, Un MILLÓN de FIRMAS para APOYO al GRAN JUEZ BALTASAR GARZÓN., Erasmus Party, Tengo hambre, por favor, tengan compasión! (mendigo hamburguesa Salamanca), 2 on 1 Stroke Berlin, MEGASPREE, Erasmus Party in Berlin, Joga Bonito, Bar 25, Wir lieben Berlin, APDDA (Asociación Parlamentaria en Defensa de los Derechos de los Animales), Salamanca, Allen Iverson",within a day,50%,N/A,"f         ",https://a0.muscache.com/im/users/164310/profile_pic/1429348855/original.jpg?aki_policy=profile_small,https://a0.muscache.com/im/users/164310/profile_pic/1429348855/original.jpg?aki_policy=profile_x_medium,Neukölln,"1         ","1         ","['email', 'phone', 'facebook', 'google', 'reviews', 'jumio', 'government_id']","t         ","t         ","Berlin, Berlin, Germany",Neukölln,Schillerpromenade,Neukölln,Berlin,Berlin,12049,Berlin,"Berlin, Germany",DE,Germany,52.485862608293196,13.423619080920695,"t         ",Apartment,Entire home/apt,2,1,1,2,Real Bed,"{TV,""Cable TV"",Internet,Wifi,Kitchen,""Smoking allowed"",""Pets allowed"",""Buzzer/wireless intercom"",Heating,""Family/kid friendly"",Washer,Dryer}",NULL,$80.00,$250.00,"$1,000.00",$500.00,$35.00,2,$0.00,"10        ","20        ",3 months ago,t,0,5,35,310,2018-11-07,6,2010-07-28,2012-07-27,87,10,10,10,10,10,10,t,NULL,NULL,"f         ",f,flexible,"f         ","f         ",1,0.06
38296,2019-11-06,"t         ",$80.00,38296,132126,2010-11-02,238238,Valery,"Had a nice time at oliver's place. A quiet big studio. The Ackerstrasse is central, the supermarket is next door. Great!",38296,nice apartment to rent in Neukölln in September!,164310,Oliver,Neukölln,Schillerpromenade,52.485862608293196,13.423619080920695,Entire home/apt,80,"10        ",6,2012-07-27,0.06,1,310,38296,https://www.airbnb.com/rooms/38296,20181107122246,2018-11-07,nice apartment to rent in Neukölln in September!,"Our spacious and bright 2-room apartment will be available the whole month of September for 70 € / night, discount for weekly stay on request or by calculation of AirBnB. Extension is possible. Washing mashine, dishwasher, WiFi, foldable guest bed, etc. Everything provided. Super-nice area. Directly at Hermannplatz, perfect connection to public transport U8/U7","SPACIOUS AND BRIGHT TWO-ROOM APARTMENT TO RENT FOR THE WHOLE MONTH OF SEPTEMBER IN BERLIN_NEUKÖLLN !!! - situated in a really nice neighbourhood @ Hermannstrasse/Hermannplatz, 3 min to Weserkiez, 5 min to Tempelhofer Feld, 2 min to Hasenheide, perfect connection to public transport - completely furnitured & equiped, Internet DSL, Telefone ISDN, washing mashine, Balcony etc. for only (Phone number hidden by Airbnb) € / month - ATTENTION: FLAT AVAILABLE ONLY FOR A MINIMUM OF TWO WEEKS !!! - - WE MIGHT HAVE TO SHORTEN OUR STAY, SO IT'S POSSIBLE THAT WE ARE BACK ON SHORT NOTICE (2-3 DAYS), SO YOU HAVE TO BE FLEXIBLE  E-Mail: (Email hidden by Airbnb)  Mobile: (Phone number hidden by Airbnb)","Our spacious and bright 2-room apartment will be available the whole month of September for 70 € / night, discount for weekly stay on request or by calculation of AirBnB. Extension is possible. Washing mashine, dishwasher, WiFi, foldable guest bed, etc. Everything provided. Super-nice area. Directly at Hermannplatz, perfect connection to public transport U8/U7 SPACIOUS AND BRIGHT TWO-ROOM APARTMENT TO RENT FOR THE WHOLE MONTH OF SEPTEMBER IN BERLIN_NEUKÖLLN !!! - situated in a really nice neighbourhood @ Hermannstrasse/Hermannplatz, 3 min to Weserkiez, 5 min to Tempelhofer Feld, 2 min to Hasenheide, perfect connection to public transport - completely furnitured & equiped, Internet DSL, Telefone ISDN, washing mashine, Balcony etc. for only (Phone number hidden by Airbnb) € / month - ATTENTION: FLAT AVAILABLE ONLY FOR A MINIMUM OF TWO WEEKS !!! - - WE MIGHT HAVE TO SHORTEN OUR STAY, SO IT'S POSSIBLE THAT WE ARE BACK ON SHORT NOTICE (2-3 DAYS), SO YOU HAVE TO BE FLEXIBLE  E-Mail: (Email h",none,NULL,"- es kann sei dass wir kurzfristig zurückmüssen, daher Stornierung +/- 3 Tage im Voraus möglich",NULL,whole apartment,NULL,NULL,NULL,NULL,https://a0.muscache.com/im/pictures/75465883/271bf752_original.jpg?aki_policy=large,NULL,164310,https://www.airbnb.com/users/show/164310,Oliver,2010-07-12,"Berlin, Berlin, Germany","(Hidden by Airbnb) Likes:
Las Papayas de Celaya, Jonathan Emile, Berlin, Germany, Concerts in Berlin, cassiopeia Berlin, Un MILLÓN de FIRMAS para APOYO al GRAN JUEZ BALTASAR GARZÓN., Erasmus Party, Tengo hambre, por favor, tengan compasión! (mendigo hamburguesa Salamanca), 2 on 1 Stroke Berlin, MEGASPREE, Erasmus Party in Berlin, Joga Bonito, Bar 25, Wir lieben Berlin, APDDA (Asociación Parlamentaria en Defensa de los Derechos de los Animales), Salamanca, Allen Iverson",within a day,50%,N/A,"f         ",https://a0.muscache.com/im/users/164310/profile_pic/1429348855/original.jpg?aki_policy=profile_small,https://a0.muscache.com/im/users/164310/profile_pic/1429348855/original.jpg?aki_policy=profile_x_medium,Neukölln,"1         ","1         ","['email', 'phone', 'facebook', 'google', 'reviews', 'jumio', 'government_id']","t         ","t         ","Berlin, Berlin, Germany",Neukölln,Schillerpromenade,Neukölln,Berlin,Berlin,12049,Berlin,"Berlin, Germany",DE,Germany,52.485862608293196,13.423619080920695,"t         ",Apartment,Entire home/apt,2,1,1,2,Real Bed,"{TV,""Cable TV"",Internet,Wifi,Kitchen,""Smoking allowed"",""Pets allowed"",""Buzzer/wireless intercom"",Heating,""Family/kid friendly"",Washer,Dryer}",NULL,$80.00,$250.00,"$1,000.00",$500.00,$35.00,2,$0.00,"10        ","20        ",3 months ago,t,0,5,35,310,2018-11-07,6,2010-07-28,2012-07-27,87,10,10,10,10,10,10,t,NULL,NULL,"f         ",f,flexible,"f         ","f         ",1,0.06
38296,2019-11-06,"t         ",$80.00,38296,70286,2010-07-28,173452,Kane,Le séjour chez Wolf était excellent. Appartement bien équipe et propre. Et Wolf est très gentil et sympatique.,38296,nice apartment to rent in Neukölln in September!,164310,Oliver,Neukölln,Schillerpromenade,52.485862608293196,13.423619080920695,Entire home/apt,80,"10        ",6,2012-07-27,0.06,1,310,38296,https://www.airbnb.com/rooms/38296,20181107122246,2018-11-07,nice apartment to rent in Neukölln in September!,"Our spacious and bright 2-room apartment will be available the whole month of September for 70 € / night, discount for weekly stay on request or by calculation of AirBnB. Extension is possible. Washing mashine, dishwasher, WiFi, foldable guest bed, etc. Everything provided. Super-nice area. Directly at Hermannplatz, perfect connection to public transport U8/U7","SPACIOUS AND BRIGHT TWO-ROOM APARTMENT TO RENT FOR THE WHOLE MONTH OF SEPTEMBER IN BERLIN_NEUKÖLLN !!! - situated in a really nice neighbourhood @ Hermannstrasse/Hermannplatz, 3 min to Weserkiez, 5 min to Tempelhofer Feld, 2 min to Hasenheide, perfect connection to public transport - completely furnitured & equiped, Internet DSL, Telefone ISDN, washing mashine, Balcony etc. for only (Phone number hidden by Airbnb) € / month - ATTENTION: FLAT AVAILABLE ONLY FOR A MINIMUM OF TWO WEEKS !!! - - WE MIGHT HAVE TO SHORTEN OUR STAY, SO IT'S POSSIBLE THAT WE ARE BACK ON SHORT NOTICE (2-3 DAYS), SO YOU HAVE TO BE FLEXIBLE  E-Mail: (Email hidden by Airbnb)  Mobile: (Phone number hidden by Airbnb)","Our spacious and bright 2-room apartment will be available the whole month of September for 70 € / night, discount for weekly stay on request or by calculation of AirBnB. Extension is possible. Washing mashine, dishwasher, WiFi, foldable guest bed, etc. Everything provided. Super-nice area. Directly at Hermannplatz, perfect connection to public transport U8/U7 SPACIOUS AND BRIGHT TWO-ROOM APARTMENT TO RENT FOR THE WHOLE MONTH OF SEPTEMBER IN BERLIN_NEUKÖLLN !!! - situated in a really nice neighbourhood @ Hermannstrasse/Hermannplatz, 3 min to Weserkiez, 5 min to Tempelhofer Feld, 2 min to Hasenheide, perfect connection to public transport - completely furnitured & equiped, Internet DSL, Telefone ISDN, washing mashine, Balcony etc. for only (Phone number hidden by Airbnb) € / month - ATTENTION: FLAT AVAILABLE ONLY FOR A MINIMUM OF TWO WEEKS !!! - - WE MIGHT HAVE TO SHORTEN OUR STAY, SO IT'S POSSIBLE THAT WE ARE BACK ON SHORT NOTICE (2-3 DAYS), SO YOU HAVE TO BE FLEXIBLE  E-Mail: (Email h",none,NULL,"- es kann sei dass wir kurzfristig zurückmüssen, daher Stornierung +/- 3 Tage im Voraus möglich",NULL,whole apartment,NULL,NULL,NULL,NULL,https://a0.muscache.com/im/pictures/75465883/271bf752_original.jpg?aki_policy=large,NULL,164310,https://www.airbnb.com/users/show/164310,Oliver,2010-07-12,"Berlin, Berlin, Germany","(Hidden by Airbnb) Likes:
Las Papayas de Celaya, Jonathan Emile, Berlin, Germany, Concerts in Berlin, cassiopeia Berlin, Un MILLÓN de FIRMAS para APOYO al GRAN JUEZ BALTASAR GARZÓN., Erasmus Party, Tengo hambre, por favor, tengan compasión! (mendigo hamburguesa Salamanca), 2 on 1 Stroke Berlin, MEGASPREE, Erasmus Party in Berlin, Joga Bonito, Bar 25, Wir lieben Berlin, APDDA (Asociación Parlamentaria en Defensa de los Derechos de los Animales), Salamanca, Allen Iverson",within a day,50%,N/A,"f         ",https://a0.muscache.com/im/users/164310/profile_pic/1429348855/original.jpg?aki_policy=profile_small,https://a0.muscache.com/im/users/164310/profile_pic/1429348855/original.jpg?aki_policy=profile_x_medium,Neukölln,"1         ","1         ","['email', 'phone', 'facebook', 'google', 'reviews', 'jumio', 'government_id']","t         ","t         ","Berlin, Berlin, Germany",Neukölln,Schillerpromenade,Neukölln,Berlin,Berlin,12049,Berlin,"Berlin, Germany",DE,Germany,52.485862608293196,13.423619080920695,"t         ",Apartment,Entire home/apt,2,1,1,2,Real Bed,"{TV,""Cable TV"",Internet,Wifi,Kitchen,""Smoking allowed"",""Pets allowed"",""Buzzer/wireless intercom"",Heating,""Family/kid friendly"",Washer,Dryer}",NULL,$80.00,$250.00,"$1,000.00",$500.00,$35.00,2,$0.00,"10        ","20        ",3 months ago,t,0,5,35,310,2018-11-07,6,2010-07-28,2012-07-27,87,10,10,10,10,10,10,t,NULL,NULL,"f         ",f,flexible,"f         ","f         ",1,0.06
38296,2019-11-06,"t         ",$80.00,38296,1809922,2012-07-27,120442,Milena,"Had such a great time at Oliver's place, would recommend this place to everybody...Oliver is really nice, and hopefully we meet again either in Germany or in Croatia!",38296,nice apartment to rent in Neukölln in September!,164310,Oliver,Neukölln,Schillerpromenade,52.485862608293196,13.423619080920695,Entire home/apt,80,"10        ",6,2012-07-27,0.06,1,310,38296,https://www.airbnb.com/rooms/38296,20181107122246,2018-11-07,nice apartment to rent in Neukölln in September!,"Our spacious and bright 2-room apartment will be available the whole month of September for 70 € / night, discount for weekly stay on request or by calculation of AirBnB. Extension is possible. Washing mashine, dishwasher, WiFi, foldable guest bed, etc. Everything provided. Super-nice area. Directly at Hermannplatz, perfect connection to public transport U8/U7","SPACIOUS AND BRIGHT TWO-ROOM APARTMENT TO RENT FOR THE WHOLE MONTH OF SEPTEMBER IN BERLIN_NEUKÖLLN !!! - situated in a really nice neighbourhood @ Hermannstrasse/Hermannplatz, 3 min to Weserkiez, 5 min to Tempelhofer Feld, 2 min to Hasenheide, perfect connection to public transport - completely furnitured & equiped, Internet DSL, Telefone ISDN, washing mashine, Balcony etc. for only (Phone number hidden by Airbnb) € / month - ATTENTION: FLAT AVAILABLE ONLY FOR A MINIMUM OF TWO WEEKS !!! - - WE MIGHT HAVE TO SHORTEN OUR STAY, SO IT'S POSSIBLE THAT WE ARE BACK ON SHORT NOTICE (2-3 DAYS), SO YOU HAVE TO BE FLEXIBLE  E-Mail: (Email hidden by Airbnb)  Mobile: (Phone number hidden by Airbnb)","Our spacious and bright 2-room apartment will be available the whole month of September for 70 € / night, discount for weekly stay on request or by calculation of AirBnB. Extension is possible. Washing mashine, dishwasher, WiFi, foldable guest bed, etc. Everything provided. Super-nice area. Directly at Hermannplatz, perfect connection to public transport U8/U7 SPACIOUS AND BRIGHT TWO-ROOM APARTMENT TO RENT FOR THE WHOLE MONTH OF SEPTEMBER IN BERLIN_NEUKÖLLN !!! - situated in a really nice neighbourhood @ Hermannstrasse/Hermannplatz, 3 min to Weserkiez, 5 min to Tempelhofer Feld, 2 min to Hasenheide, perfect connection to public transport - completely furnitured & equiped, Internet DSL, Telefone ISDN, washing mashine, Balcony etc. for only (Phone number hidden by Airbnb) € / month - ATTENTION: FLAT AVAILABLE ONLY FOR A MINIMUM OF TWO WEEKS !!! - - WE MIGHT HAVE TO SHORTEN OUR STAY, SO IT'S POSSIBLE THAT WE ARE BACK ON SHORT NOTICE (2-3 DAYS), SO YOU HAVE TO BE FLEXIBLE  E-Mail: (Email h",none,NULL,"- es kann sei dass wir kurzfristig zurückmüssen, daher Stornierung +/- 3 Tage im Voraus möglich",NULL,whole apartment,NULL,NULL,NULL,NULL,https://a0.muscache.com/im/pictures/75465883/271bf752_original.jpg?aki_policy=large,NULL,164310,https://www.airbnb.com/users/show/164310,Oliver,2010-07-12,"Berlin, Berlin, Germany","(Hidden by Airbnb) Likes:
Las Papayas de Celaya, Jonathan Emile, Berlin, Germany, Concerts in Berlin, cassiopeia Berlin, Un MILLÓN de FIRMAS para APOYO al GRAN JUEZ BALTASAR GARZÓN., Erasmus Party, Tengo hambre, por favor, tengan compasión! (mendigo hamburguesa Salamanca), 2 on 1 Stroke Berlin, MEGASPREE, Erasmus Party in Berlin, Joga Bonito, Bar 25, Wir lieben Berlin, APDDA (Asociación Parlamentaria en Defensa de los Derechos de los Animales), Salamanca, Allen Iverson",within a day,50%,N/A,"f         ",https://a0.muscache.com/im/users/164310/profile_pic/1429348855/original.jpg?aki_policy=profile_small,https://a0.muscache.com/im/users/164310/profile_pic/1429348855/original.jpg?aki_policy=profile_x_medium,Neukölln,"1         ","1         ","['email', 'phone', 'facebook', 'google', 'reviews', 'jumio', 'government_id']","t         ","t         ","Berlin, Berlin, Germany",Neukölln,Schillerpromenade,Neukölln,Berlin,Berlin,12049,Berlin,"Berlin, Germany",DE,Germany,52.485862608293196,13.423619080920695,"t         ",Apartment,Entire home/apt,2,1,1,2,Real Bed,"{TV,""Cable TV"",Internet,Wifi,Kitchen,""Smoking allowed"",""Pets allowed"",""Buzzer/wireless intercom"",Heating,""Family/kid friendly"",Washer,Dryer}",NULL,$80.00,$250.00,"$1,000.00",$500.00,$35.00,2,$0.00,"10        ","20        ",3 months ago,t,0,5,35,310,2018-11-07,6,2010-07-28,2012-07-27,87,10,10,10,10,10,10,t,NULL,NULL,"f         ",f,flexible,"f         ","f         ",1,0.06
38296,2019-11-06,"t         ",$80.00,38296,792383,2011-12-19,848894,Die-Unterbringer,The host canceled my reservation 11 days before arrival.,38296,nice apartment to rent in Neukölln in September!,164310,Oliver,Neukölln,Schillerpromenade,52.485862608293196,13.423619080920695,Entire home/apt,80,"10        ",6,2012-07-27,0.06,1,310,38296,https://www.airbnb.com/rooms/38296,20181107122246,2018-11-07,nice apartment to rent in Neukölln in September!,"Our spacious and bright 2-room apartment will be available the whole month of September for 70 € / night, discount for weekly stay on request or by calculation of AirBnB. Extension is possible. Washing mashine, dishwasher, WiFi, foldable guest bed, etc. Everything provided. Super-nice area. Directly at Hermannplatz, perfect connection to public transport U8/U7","SPACIOUS AND BRIGHT TWO-ROOM APARTMENT TO RENT FOR THE WHOLE MONTH OF SEPTEMBER IN BERLIN_NEUKÖLLN !!! - situated in a really nice neighbourhood @ Hermannstrasse/Hermannplatz, 3 min to Weserkiez, 5 min to Tempelhofer Feld, 2 min to Hasenheide, perfect connection to public transport - completely furnitured & equiped, Internet DSL, Telefone ISDN, washing mashine, Balcony etc. for only (Phone number hidden by Airbnb) € / month - ATTENTION: FLAT AVAILABLE ONLY FOR A MINIMUM OF TWO WEEKS !!! - - WE MIGHT HAVE TO SHORTEN OUR STAY, SO IT'S POSSIBLE THAT WE ARE BACK ON SHORT NOTICE (2-3 DAYS), SO YOU HAVE TO BE FLEXIBLE  E-Mail: (Email hidden by Airbnb)  Mobile: (Phone number hidden by Airbnb)","Our spacious and bright 2-room apartment will be available the whole month of September for 70 € / night, discount for weekly stay on request or by calculation of AirBnB. Extension is possible. Washing mashine, dishwasher, WiFi, foldable guest bed, etc. Everything provided. Super-nice area. Directly at Hermannplatz, perfect connection to public transport U8/U7 SPACIOUS AND BRIGHT TWO-ROOM APARTMENT TO RENT FOR THE WHOLE MONTH OF SEPTEMBER IN BERLIN_NEUKÖLLN !!! - situated in a really nice neighbourhood @ Hermannstrasse/Hermannplatz, 3 min to Weserkiez, 5 min to Tempelhofer Feld, 2 min to Hasenheide, perfect connection to public transport - completely furnitured & equiped, Internet DSL, Telefone ISDN, washing mashine, Balcony etc. for only (Phone number hidden by Airbnb) € / month - ATTENTION: FLAT AVAILABLE ONLY FOR A MINIMUM OF TWO WEEKS !!! - - WE MIGHT HAVE TO SHORTEN OUR STAY, SO IT'S POSSIBLE THAT WE ARE BACK ON SHORT NOTICE (2-3 DAYS), SO YOU HAVE TO BE FLEXIBLE  E-Mail: (Email h",none,NULL,"- es kann sei dass wir kurzfristig zurückmüssen, daher Stornierung +/- 3 Tage im Voraus möglich",NULL,whole apartment,NULL,NULL,NULL,NULL,https://a0.muscache.com/im/pictures/75465883/271bf752_original.jpg?aki_policy=large,NULL,164310,https://www.airbnb.com/users/show/164310,Oliver,2010-07-12,"Berlin, Berlin, Germany","(Hidden by Airbnb) Likes:
Las Papayas de Celaya, Jonathan Emile, Berlin, Germany, Concerts in Berlin, cassiopeia Berlin, Un MILLÓN de FIRMAS para APOYO al GRAN JUEZ BALTASAR GARZÓN., Erasmus Party, Tengo hambre, por favor, tengan compasión! (mendigo hamburguesa Salamanca), 2 on 1 Stroke Berlin, MEGASPREE, Erasmus Party in Berlin, Joga Bonito, Bar 25, Wir lieben Berlin, APDDA (Asociación Parlamentaria en Defensa de los Derechos de los Animales), Salamanca, Allen Iverson",within a day,50%,N/A,"f         ",https://a0.muscache.com/im/users/164310/profile_pic/1429348855/original.jpg?aki_policy=profile_small,https://a0.muscache.com/im/users/164310/profile_pic/1429348855/original.jpg?aki_policy=profile_x_medium,Neukölln,"1         ","1         ","['email', 'phone', 'facebook', 'google', 'reviews', 'jumio', 'government_id']","t         ","t         ","Berlin, Berlin, Germany",Neukölln,Schillerpromenade,Neukölln,Berlin,Berlin,12049,Berlin,"Berlin, Germany",DE,Germany,52.485862608293196,13.423619080920695,"t         ",Apartment,Entire home/apt,2,1,1,2,Real Bed,"{TV,""Cable TV"",Internet,Wifi,Kitchen,""Smoking allowed"",""Pets allowed"",""Buzzer/wireless intercom"",Heating,""Family/kid friendly"",Washer,Dryer}",NULL,$80.00,$250.00,"$1,000.00",$500.00,$35.00,2,$0.00,"10        ","20        ",3 months ago,t,0,5,35,310,2018-11-07,6,2010-07-28,2012-07-27,87,10,10,10,10,10,10,t,NULL,NULL,"f         ",f,flexible,"f         ","f         ",1,0.06
